{
  "schema_version": "1.3",
  "status": "complete",
  "packages": [{
    "segment_id": "SEG001",
    "shot_ids": ["S01"],
    "shot_bindings": [{ "prompt_shot_index": 1, "shot_id": "S01", "local_start": 0 }],
    "start": 0,
    "end": 5,
    "local_duration": 5,
    "prompt_schema": "unified_multimodal",
    "execution_node": "MiniMax H3 Unified to Video",
    "unified_controls": {
      "entry_source": "resolved_first_frame",
      "last_frame_target": null,
      "reference_media": ["REF001"]
    },
    "prompt": "integrated_multimodal_description: 以输入首帧作为视频的准确起始画面，保持首帧中的镜头角度、构图、人物位置、环境布局和光照关系。主角身份和外观参考 <Picture 1>，保持 <Picture 1> 中人物的面部特征、发型、服装款式和身体特征一致，但不要复制 <Picture 1> 的背景、构图和姿势。一位女子坐在书桌前，中等景别，平视角度，机位在书桌正前方，镜头缓慢推近。她起初专注于桌面，随后动作停顿，仿佛听到某个声音，抬起头向上望去，表情带着警觉的好奇。环境是安静的书房，桌面暖色台灯照亮人物。画面为电影写实风格，16:9。无台词，无可见文字。视频在约第 0 秒开始，持续 5 秒，所有动作在此期间内完成。overall_soundscape: 安静书房的环境底噪，混合轻柔的房间氛围声，远处传来一声敲门声；无其他明显声源。non_diegetic_music: 无配乐。",
    "media_mapping": {
      "entry_frame": "FF001",
      "entry_frame_source_type": "resolved_media",
      "runtime_entry_binding": null,
      "last_frame_target": null,
      "expected_actual_tail_frame": null,
      "reference_media": ["REF001"],
      "reference_bindings": [{
        "label": "Picture 1",
        "media_id": "REF001",
        "role": "character_reference",
        "preserve": ["identity", "face", "hair", "wardrobe", "body"],
        "do_not_copy": ["background", "composition", "pose"]
      }]
    }
  }],
  "errors": []
}
